{
  "version": 4,
  "last_updated": "2026-03-20T15:30:00",
  "last_writer": "workspace-manager",
  "mappings": {
    "people": [
      {"raw": "Sam", "canonical_id": "person_001", "confidence": 1.0, "added_ts": "2025-11-04T10:00:00", "added_by": "workspace-manager"},
      {"raw": "D. Lowry", "canonical_id": "person_001", "confidence": 1.0, "added_ts": "2025-11-20T12:00:00", "added_by": "people-crm"},
      {"raw": "Rio", "canonical_id": "person_002", "confidence": 1.0, "added_ts": "2025-12-11T09:00:00", "added_by": "people-crm"},
      {"raw": "Skyler", "canonical_id": "person_003", "confidence": 1.0, "added_ts": "2026-01-08T10:00:00", "added_by": "people-crm"},
      {"raw": "[Counterpart]", "canonical_id": "person_004", "confidence": 1.0, "added_ts": "2025-10-22T10:00:00", "added_by": "people-crm"}
    ],
    "projects": [],
    "orgs": [
      {"raw": "Summit", "canonical_id": "org_acme_co", "confidence": 1.0, "added_ts": "2025-11-04T10:00:00", "added_by": "workspace-manager"},
      {"raw": "SummitCo", "canonical_id": "org_acme_co", "confidence": 0.95, "added_ts": "2025-12-01T10:00:00", "added_by": "people-crm"},
      {"raw": "NorthStar", "canonical_id": "org_northstar", "confidence": 1.0, "added_ts": "2026-01-08T10:00:00", "added_by": "workspace-manager"},
      {"raw": "[Operating Co]", "canonical_id": "org_acme_property", "confidence": 1.0, "added_ts": "2025-10-22T10:00:00", "added_by": "workspace-manager"},
      {"raw": "[Operating Co]", "canonical_id": "org_acme_property", "confidence": 1.0, "added_ts": "2025-10-22T10:00:00", "added_by": "workspace-manager"}
    ]
  }
}
