{
  "version": 4,
  "last_updated": "2026-06-01T00:00:00+00:00",
  "last_writer": "workspace-manager",
  "mappings": {
    "people": [
      {"raw": "Sam", "canonical_id": "person_001", "confidence": 1.0},
      {"raw": "Rio", "canonical_id": "person_002", "confidence": 1.0},
      {"raw": "Mira", "canonical_id": "person_004", "confidence": 1.0}
    ],
    "orgs": [
      {"raw": "Acme", "canonical_id": "org_001", "confidence": 1.0},
      {"raw": "Northstar Partners", "canonical_id": "org_002", "confidence": 1.0}
    ],
    "threads": [
      {"raw": "Sourcing Bot", "canonical_id": "project_001", "confidence": 1.0}
    ]
  }
}
